{
  "schema_version": "1",
  "source_prd_sha256": "99d3455ba4dcd995dc8e8074fbb848ab196acee84224333828f1607af5b4a473",
  "parser_version": "1",
  "extractor_id": "prd-extractor-v1",
  "independent_review": {
    "reviewer_id": "independent-human-reviewer",
    "status": "completed",
    "reviewed_prd_sha256": "99d3455ba4dcd995dc8e8074fbb848ab196acee84224333828f1607af5b4a473",
    "source_unit_count": 10,
    "conclusion": "no_deltas",
    "evidence": ["Compared every source unit against the independent requirement extraction."]
  },
  "classifications": [
    {"source_ref": "SRC-1169b20a1db490d727ef", "classification": "context", "reason": "章节标签"},
    {"source_ref": "SRC-f4f144538497d8452d81", "classification": "context", "reason": "概述背景"},
    {"source_ref": "SRC-523be7bc9c509396a8e3", "classification": "context", "reason": "章节标签"},
    {"source_ref": "SRC-07b9ebaf6d6fb02db9c4", "classification": "functional_requirement"},
    {"source_ref": "SRC-afc633f424ee775c14ea", "classification": "functional_requirement"},
    {"source_ref": "SRC-b301f31bdf8fc3782bd7", "classification": "business_rule"},
    {"source_ref": "SRC-7e06ba0a55d48041f2fc", "classification": "operation"},
    {"source_ref": "SRC-0f6232a7577f8bc4a684", "classification": "context", "reason": "表格列标题"},
    {"source_ref": "SRC-edaa6bfb5cd0160458ef", "classification": "context", "reason": "字段说明供建模参考"},
    {"source_ref": "SRC-ac1af372b3da18405056", "classification": "context", "reason": "字段说明供建模参考"}
  ],
  "requirements": [
    {"id": "REQ-001", "statement": "允许订单部分退款。", "status": "已确认", "mandatory": true, "testable": true, "source_refs": ["SRC-07b9ebaf6d6fb02db9c4"]},
    {"id": "REQ-002", "statement": "支持以剩余可退金额为上限。", "status": "已确认", "mandatory": true, "testable": true, "source_refs": ["SRC-07b9ebaf6d6fb02db9c4"]},
    {"id": "REQ-003", "statement": "用户可以提交退款申请。", "status": "已确认", "mandatory": true, "testable": true, "source_refs": ["SRC-afc633f424ee775c14ea"]},
    {"id": "REQ-004", "statement": "退款金额不得超过剩余可退金额。", "status": "已确认", "mandatory": true, "testable": true, "source_refs": ["SRC-b301f31bdf8fc3782bd7"]},
    {"id": "REQ-005", "statement": "系统生成退款单。", "status": "已确认", "mandatory": true, "testable": true, "source_refs": ["SRC-7e06ba0a55d48041f2fc"]}
  ],
  "review_deltas": [],
  "asset_reviews": []
}
