{
  "schema_version": "1",
  "source_prd_sha256": "",
  "parser_version": "",
  "extractor_id": "",
  "classifications": [],
  "requirements": [],
  "review_deltas": [],
  "independent_review": {
    "reviewer_id": "",
    "status": "pending",
    "reviewed_prd_sha256": "",
    "source_unit_count": 0,
    "conclusion": "no_deltas",
    "evidence": []
  },
  "asset_reviews": []
}
